note,review_type,level,note_warn_count,check_warn_count,check,finding
memory-management-policy-is-learnable-but-oracle-dependent.md,frontmatter-review,CLEAN,0,0,Description discrimination,"The description adds mechanism (AgeMem stores facts in memory, learns policy in weights), scope (clean subsymbolic case of durable learning), and implication (depends on task-completion oracles the KB lacks). All three dimensions go well beyond the title's abstract claim, giving an agent enough to distinguish this note from related oracle or learning notes in search results."
memory-management-policy-is-learnable-but-oracle-dependent.md,frontmatter-review,CLEAN,0,0,Title-body alignment,"The body delivers on both halves of the title. ""What it learns: the policy, not the operations"" establishes learnability; ""Why it works: the oracle"" and ""Comparison to KB learning"" establish oracle dependency. The body extends into substrate splits and KB implications, but these serve the title's claim rather than drifting from it."
periodic-kb-hygiene-should-be-externally-triggered-not-embedded-in-routing.md,frontmatter-review,CLEAN,0,0,Claim strength,"The claim is specific and contestable -- someone could argue that embedding hygiene reminders in always-loaded routing is fine because the overhead is negligible, or that agents can skip irrelevant instructions without meaningful cost. This is a genuine architectural opinion, not a truism."
periodic-kb-hygiene-should-be-externally-triggered-not-embedded-in-routing.md,frontmatter-review,CLEAN,0,0,Description discrimination,"The description adds mechanism (""Routing instructions load every session for high-frequency decisions"") and implication (""periodic hygiene adds noise on every session while helping only occasionally, blurring routing and operations""). This goes well beyond restating the title -- it explains why the separation matters and names the cost of violating it."
periodic-kb-hygiene-should-be-externally-triggered-not-embedded-in-routing.md,frontmatter-review,CLEAN,0,0,Title-body alignment,"The body directly supports the title: it explains why routing instructions should optimize for high-frequency decisions, identifies periodic hygiene as low-frequency operational maintenance, names the two blurred responsibilities (routing vs operations), and points to the maintenance operations catalogue as the correct home."
spec-mining-as-codification.md,frontmatter-review,CLEAN,0,0,claim-strength,"The title asserts that spec mining is THE operational mechanism for codification — a specific, contestable claim. Someone could argue codification has other mechanisms (top-down formal specification, design-by-contract) or that spec mining is one of several rather than the primary one."
spec-mining-as-codification.md,frontmatter-review,CLEAN,0,0,description-discrimination,"The description adds mechanism (""extracting deterministic verifiers from observed stochastic behavior"") and implication (""converts blurry-zone components into calculators"") beyond what the title carries. An agent choosing among multiple codification-related results would reliably pick this note from the description alone."
spec-mining-as-codification.md,frontmatter-review,CLEAN,0,0,title-body-alignment,"The body delivers on the title's promise: it defines the spec-mining pattern (watch, identify, extract, re-run), explains why it operationalizes codification, and grounds it in the bitter lesson boundary and oracle strength spectrum. The expansions into concrete workflow and risks serve the central claim rather than drifting from it."
spec-mining-as-codification.md,frontmatter-review,CLEAN,0,0,title-composability,"""since spec mining is codification's operational mechanism, we designed..."" reads as natural prose. The title works as a linkable sentence fragment."
specification-level-separation-recovers-scoping-before-it-recovers-error-correction.md,frontmatter-review,CLEAN,0,0,Claim strength,"The title asserts a specific ordering: scoping benefits arrive before error-correction benefits when separation stays at the specification level. This is non-obvious and contestable -- someone could argue that specification-level approaches recover some error correction early (e.g., compile-time structural validation) or that the two arrive together. The claim carries real information."
specification-level-separation-recovers-scoping-before-it-recovers-error-correction.md,frontmatter-review,CLEAN,0,0,Description discrimination,The description adds mechanism (OpenProse-like DSLs expose control flow and discretion boundaries while leaving scheduling/validation on the LLM substrate) and scope (names the intermediate regime between flat prompting and symbolic scheduling). It does not restate the title's ordering claim; instead it tells the reader what kind of systems this applies to and what the intermediate regime looks like. Strong discriminator in a search result set.
specification-level-separation-recovers-scoping-before-it-recovers-error-correction.md,frontmatter-review,CLEAN,0,0,Title-body alignment,"The body uses OpenProse as a case study to establish exactly the title's claim: naming control flow and externalizing state recovers scoping (cleaner frame boundaries, reduced ambiguity, resumability) but not yet error correction (hard-oracle enforcement, deterministic parsing). The body's explicit statement ""Syntax and file protocols can recover scoping, resumability, and some orchestration discipline before they recover hard reliability"" directly matches the title. The additional distinction from tool-use frameworks is within scope -- it clarifies what specification-level separation is not."
stale-indexes-are-worse-than-no-indexes.md,frontmatter-review,CLEAN,0,0,Claim strength,"The claim is non-obvious and contestable. A reasonable person could argue that even a stale index provides partial value, or that agents should be designed to not treat indexes as exhaustive. The specific insight — that the absence of an index degrades to search while a stale index suppresses search entirely — is a genuine asymmetry, not a truism."
stale-indexes-are-worse-than-no-indexes.md,frontmatter-review,CLEAN,0,0,Description discrimination,"Description ""An agent trusts an index as exhaustive — a missing entry doesn't trigger search, it makes the note invisible"" adds mechanism (agents trust indexes as exhaustive, suppressing fallback search) and implication (missing entries cause invisibility) that the title alone doesn't carry. In a list of search results about index maintenance or staleness, this description clearly identifies the specific asymmetry this note argues."
stale-indexes-are-worse-than-no-indexes.md,frontmatter-review,CLEAN,0,0,Title-body alignment,"The body establishes the title's claim in the first two paragraphs (the asymmetry between no-index and stale-index), then extends into defenses and the critical creation moment. The extensions are practical consequences of the claim, not drift away from it. The body does generalize beyond indexes to ""any authoritative artifact"" in paragraph 3, but this is clearly marked as a generalization and the core argument stays on indexes as promised by the title."
substrate-class-backend-and-artifact-form-are-separate-axes-that-get-conflated.md,frontmatter-review,CLEAN,0,0,claim-strength,"The claim that these three levels ""get conflated"" is specific and contestable — someone could argue the standard ""tips vs weights"" framing is adequate, or that backend is not a meaningfully separate axis from artifact form. The note argues a non-obvious taxonomic distinction."
substrate-class-backend-and-artifact-form-are-separate-axes-that-get-conflated.md,frontmatter-review,CLEAN,0,0,description-discrimination,"The description adds concrete examples (""tips, notes, rules, prompts, schemas, and playbooks"") and names specific backends (""repos, databases, or memory services"") that the title cannot carry. An agent searching for ""symbolic artifact substrate"" or ""tips vs weights taxonomy"" would be able to distinguish this note from related results like ""continuous-learning-requires-durability-not-weight-updates"" or ""trace-derived-learning-techniques-in-related-systems"" based on the description alone."
substrate-class-backend-and-artifact-form-are-separate-axes-that-get-conflated.md,frontmatter-review,CLEAN,0,0,title-body-alignment,"The title promises three separate axes that get conflated, and the body delivers all three: it defines substrate class (subsymbolic vs symbolic artifact), backend (repo, database, memory service, graph store), and artifact form (tips, notes, rules, prompts, schemas). The taxonomy table at the end maps cleanly to the three axes. The ""Why the distinction matters"" section demonstrates the conflation the title names."
substrate-class-backend-and-artifact-form-are-separate-axes-that-get-conflated.md,frontmatter-review,CLEAN,0,0,title-composability,"""since substrate class, backend, and artifact form are separate axes that get conflated, we designed the taxonomy to..."" reads naturally as a sentence fragment. The title works as a linkable prose clause."
title-as-claim-enables-traversal-as-reasoning.md,frontmatter-review,CLEAN,0,0,Claim strength,"The claim is specific and contestable. Someone could argue that topic-labeled notes navigate just as well, that claim titles are too restrictive for real use, or that ""traversal as reasoning"" overstates the benefit. The note itself maps the boundaries where the pattern breaks (multi-claim documents, definitional notes), confirming that the claim is non-trivial."
title-as-claim-enables-traversal-as-reasoning.md,frontmatter-review,CLEAN,0,0,Description discrimination,"The description adds mechanism beyond the title: it explains that following links reads as reasoning chains, that the file tree becomes a scan of arguments, and that link semantics (since, because, but) encode relationship types. These are concrete consequences the title only gestures at. An agent seeing five search results could pick this note from the description alone."
title-as-claim-enables-traversal-as-reasoning.md,frontmatter-review,CLEAN,0,0,Title-body alignment,"The body establishes exactly what the title promises: it explains the mechanism (claim titles make ""since [X]"" link constructions possible), gives practical benefits (scanning file tree = scanning arguments), and maps the boundaries (multi-claim specs and definitional notes get topical titles). The extended coverage of exceptions is scope-appropriate since it delineates where the claim holds."
unified-calling-conventions-enable-bidirectional-refactoring.md,frontmatter-review,CLEAN,0,0,claim-strength,"The claim is specific and contestable — someone could argue that calling conventions are insufficient because the real barrier is semantic (type mismatches between unstructured LLM output and typed function signatures), or that unified conventions are superficial without deeper structural alignment. The claim takes a concrete position."
unified-calling-conventions-enable-bidirectional-refactoring.md,frontmatter-review,CLEAN,0,0,description-discrimination,"Description adds mechanism (""name-based dispatch over a hybrid VM"") and a concrete exemplar (llm-do) beyond what the title carries. It also names the key implication (""without changing call sites""). Strong discriminator against other notes about calling conventions or refactoring."
unified-calling-conventions-enable-bidirectional-refactoring.md,frontmatter-review,CLEAN,0,0,title-body-alignment,"The body establishes the core claim through the llm-do hybrid VM mechanism, then demonstrates bidirectionality with both the codification direction (neural to symbolic) and the relaxing direction (symbolic to neural). The scheduler and typed-callables sections extend beyond the title's strict scope but are clearly framed as additional layers, not alternative claims."
unified-calling-conventions-enable-bidirectional-refactoring.md,frontmatter-review,CLEAN,0,0,title-composability,"""since unified calling conventions enable bidirectional refactoring between neural and symbolic..."" reads naturally as a sentence fragment in linking contexts."
