note,review_type,level,note_warn_count,check_warn_count,check,finding
bitter-lesson-boundary.md,frontmatter-review,CLEAN,0,0,Title-body alignment,"The body establishes exactly what the title claims: the bitter lesson has a boundary, located at whether the specification fully captures the problem. The body goes further (characterizing the boundary, providing diagnostics, offering a confidence-signal table), but nothing in the body contradicts or drifts from the title's promise."
capability-placement-should-follow-autonomy-readiness.md,frontmatter-review,CLEAN,0,0,Claim strength,"The title asserts a specific, non-obvious organizing variable — autonomy readiness — for capability placement. Someone could reasonably argue placement should follow frequency of use, discoverability, or implementation complexity instead, or that all capabilities should be exposed as skills regardless of readiness level. The claim is genuinely contestable."
capability-placement-should-follow-autonomy-readiness.md,frontmatter-review,CLEAN,0,0,Description discrimination,"The description leads with the three-tier mechanism (""skills for autonomous-ready, instructions for reusable-but-steered, methodology notes for exploratory"") and adds the AGENTS.md consequence and the promotion-path implication. None of this duplicates the title, which names only the organizing principle. An agent seeing five results about AGENTS.md design or capability organization would immediately know this note is the one with the concrete tier decision rule. Strong discrimination."
capability-placement-should-follow-autonomy-readiness.md,frontmatter-review,CLEAN,0,0,Title-body alignment,"The body directly supports the title: it defines autonomy readiness as the organizing variable, gives a three-tier decision rule keyed to it, states the AGENTS.md consequence, and describes the migration path from exploratory notes through instructions to skills. No drift detected."
claim-notes-should-use-toulmin-derived-sections-for-structured-argument.md,frontmatter-review,CLEAN,0,0,Claim strength,"Contestable -- someone could argue Toulmin sections are too rigid for KB notes, that free-form argument is preferable, or that the scaffold creates flow problems (the note itself acknowledges this in Caveats). Not a truism."
claim-notes-should-use-toulmin-derived-sections-for-structured-argument.md,frontmatter-review,CLEAN,0,0,Description discrimination,"Description adds mechanism (""three independent threads converged on Toulmin's argument structure"") and scope (""separates claim-titled notes (any note) from fully argued claims (the type)""). Neither restates the title. An agent searching for ""Toulmin"" or ""structured argument"" would use the convergence detail and the claim-titled vs. type distinction to pick this note from a results list."
codification-and-relaxing-navigate-the-bitter-lesson-boundary.md,frontmatter-review,CLEAN,0,0,Claim strength,"The claim is contestable: someone could argue that systems should commit to one regime rather than maintaining a hybrid codify/relax strategy, or that the boundary isn't navigable (you just guess wrong sometimes). The title names a specific navigational strategy, not a truism."
codification-and-relaxing-navigate-the-bitter-lesson-boundary.md,frontmatter-review,CLEAN,0,0,Description discrimination,"The description adds mechanism (""since you can't identify which side of the bitter lesson boundary you're on until scale tests it"") and implication (""spec mining avoiding the vision-feature failure mode"") beyond what the title carries. An agent seeing five results about the bitter lesson boundary would use the scale-testing condition and spec mining reference to pick this note over neighbors like `bitter-lesson-boundary.md` or `spec-mining-as-codification.md`."
codification-and-relaxing-navigate-the-bitter-lesson-boundary.md,frontmatter-review,CLEAN,0,0,Title-body alignment,"The body establishes the two regimes (arithmetic vs. vision-feature), defines relaxing as codification's complement, explains why every codification is a bet, introduces spec mining as a safer approach, and provides working heuristics. All of this supports the title's claim that codification and relaxing together navigate the boundary. The extended material on epiplexity and induction bias serves as formal evidence for the claim, not scope drift."
codification.md,frontmatter-review,CLEAN,0,0,claim-strength,"The title is topical, not phrased as a claim. Topical titles are the correct form for definitional notes (term pinning), which is what this note is. No weak-claim issue applies."
codification.md,frontmatter-review,CLEAN,0,0,description-discrimination,"The description adds mechanism (""crosses a medium boundary from natural language to a symbolic medium (code), where the consumer changes (LLM → interpreter) and verification becomes exact"") and scope (""the far end of the constraining spectrum"") well beyond what the one-word title carries. In a search returning multiple constraining-related notes, this description clearly identifies this one as the definitional note for the codification concept."
codification.md,frontmatter-review,CLEAN,0,0,title-body-alignment,"The body defines codification, explains when to codify, relates it to distillation, and gives concrete examples — all consistent with a definitional title. No drift detected."
constraining-and-distillation-both-trade-generality-for-reliability-speed-and-cost.md,frontmatter-review,CLEAN,0,0,Claim strength,"The claim that both mechanisms trade generality for the same compound (reliability, speed, cost) is contestable. Someone could argue distillation is pure compression without generality loss, or that constraining's gains are not always in all three compound dimensions simultaneously. The claim is specific enough to carry information."
constraining-and-distillation-both-trade-generality-for-reliability-speed-and-cost.md,frontmatter-review,CLEAN,0,0,Description discrimination,"The description adds mechanism for both concepts (""narrows interpretation,"" ""extracts under a context budget"") and scope for where gains peak (""largest compound gain at codification, where the substrate changes"" vs ""moderate gain from reduced size""). Against a search for ""constraining distillation trade-off,"" this would clearly distinguish this note from related notes like constraining.md or distillation.md which cover individual mechanisms rather than the shared trade-off structure."
constraining-and-distillation-both-trade-generality-for-reliability-speed-and-cost.md,frontmatter-review,CLEAN,0,0,Title-body alignment,"The title claims both mechanisms trade generality for reliability/speed/cost. The body delivers exactly this: defines the capacity decomposition, gives the calculator example to make the trade-off concrete, then shows how constraining and distillation each perform the trade-off through different operations. The comparison table in ""The mechanisms differ in operation"" serves the title's claim by showing the two different paths to the same trade-off, not drifting into unrelated territory."
constraining-during-deployment-is-continuous-learning.md,frontmatter-review,CLEAN,0,0,Claim strength,"Many ML practitioners would argue continuous learning requires weight updates; calling constraining a form of learning is substantive and contestable. The note itself acknowledges this boundary (""not all continuous learning is constraining"") which confirms the claim is doing real work."
constraining-during-deployment-is-continuous-learning.md,frontmatter-review,CLEAN,0,0,Description discrimination,"Description adds mechanism (symbolic artifacts accumulate durable adaptive capacity) and scope (one form among several, specifically outside weights) beyond what the title carries. An agent seeing this among 5 continuous-learning results would immediately identify this as the constraining-specific, non-weight-update argument."
constraining-during-deployment-is-continuous-learning.md,frontmatter-review,CLEAN,0,0,Title-body alignment,"The body directly supports the title: it establishes Simon's definition of learning as capacity change, shows constraining meets every part of that definition, gives concrete examples (format_date, system prompts, validation scripts), and explicitly scopes itself as ""a subset claim, not the umbrella claim."" No drift detected."
constraining.md,frontmatter-review,CLEAN,0,0,Claim strength,"The title is a bare topic, not a claim. This is explicitly a definitional note (term pinning for the KB vocabulary, description prefixed with ""Definition —""), which is a listed exception to the claim-title expectation. A bare concept name is correct here."
constraining.md,frontmatter-review,CLEAN,0,0,Description discrimination,"The description adds mechanism (""narrows the space of valid interpretations an underspecified spec admits""), scope (""from partial narrowing (conventions, structured sections) to full commitment (stored outputs, deterministic code)""), and positioning (""one of two co-equal learning mechanisms alongside distillation""). Against 5 search results for ""constraining,"" this clearly identifies the definitional note covering the full spectrum — strong retrieval value beyond what the bare title carries."
constraining.md,frontmatter-review,CLEAN,0,0,Title-body alignment,"The title ""Constraining"" promises a definitional overview. The body delivers: defines constraining as narrowing the interpretation space, positions it alongside distillation, lays out the constraining spectrum (from conventions to codification), covers the reverse operation (relaxing), and maps the orthogonal relationship to distillation. Scope matches — the note is a comprehensive definition, not a narrower claim."
context-efficiency-is-the-central-design-concern-in-agent-systems.md,frontmatter-review,CLEAN,0,0,Claim strength,"""Central design concern"" is a contestable prioritization claim. Someone could reasonably argue that reliability, tool design, or planning are more central than context efficiency. The note makes a specific argument for why context deserves priority (lowest degree of freedom, unitary channel, soft degradation). Not a truism."
context-efficiency-is-the-central-design-concern-in-agent-systems.md,frontmatter-review,CLEAN,0,0,Description discrimination,"The description adds two discriminators beyond the title: it identifies this note as ""the basis for deriving architectural responses"" (implication) and anchors it to ""the soft-degradation cost model"" (context). The first clause (""Context is the single scarce resource in agent systems"") partially restates the title, but the second clause carries enough retrieval value to distinguish this from sibling notes like ""agent-context-is-constrained-by-soft-degradation-not-hard-token-limits.md"" or ""effective-context-is-task-relative-and-complexity-relative-not-a-fixed-model-constant.md""."
context-efficiency-is-the-central-design-concern-in-agent-systems.md,frontmatter-review,CLEAN,0,0,Title-body alignment,"The body delivers on the title. It establishes context as the single scarce resource (paragraphs 1-2), explains why growing windows do not resolve the problem (section ""Growing windows address volume but not complexity""), and derives six architectural responses from context scarcity (section ""Architectural responses""). The title's claim — that context efficiency is central — is exactly what the body argues and operationalizes."
continuous-learning-requires-durability-not-weight-updates.md,frontmatter-review,CLEAN,0,0,Claim strength,"The claim that continuous learning requires durability rather than weight updates is genuinely contestable -- most ML practitioners would define continuous learning as online or incremental weight updates. The note takes a specific, non-obvious position grounded in Simon's definition. Not a truism."
continuous-learning-requires-durability-not-weight-updates.md,frontmatter-review,CLEAN,0,0,Description discrimination,"Description adds mechanism (Simon's capacity-change definition) and scope (names specific artifact types: tips, prompts, rules, schemas, tests, memory artifacts). It does not restate the title -- the title asserts the durability/weight-update distinction while the description names the theoretical grounding and the concrete artifact classes that count. Would discriminate well in a list of search results about continuous learning."
continuous-learning-requires-durability-not-weight-updates.md,frontmatter-review,CLEAN,0,0,Title-body alignment,"The body directly supports the title's claim. It establishes the ephemeral/durable boundary as the real dividing line (paragraph 3), grounds it in Simon's capacity-change definition (paragraph 2), and closes by treating weight updates and symbolic artifacts as two substrates rather than real vs. metaphorical learning (paragraph 5). No drift detected."
document-classification.md,frontmatter-review,CLEAN,0,0,Claim strength,"Title is topical, not phrased as a claim. The note is a `spec` that defines the type taxonomy — topical titles are explicitly excepted for multi-claim specs and frameworks."
document-classification.md,frontmatter-review,CLEAN,0,0,Description discrimination,"Description ""Taxonomy overview — the base types table and migration from old flat types; global field definitions, status, and traits live in types/note.md"" adds scope (what the note covers: base types table, migration) and a boundary (what it does NOT cover: global fields live in types/note.md). An agent seeing multiple type-system results would distinguish this as the taxonomy overview with migration info, not the design rationale or the field definitions."
document-classification.md,frontmatter-review,CLEAN,0,0,Title-body alignment,"Title promises a classification system; body delivers a base types table with structural tests and verifiability criteria for each type, plus a migration table from old flat types. Scope matches."
document-types-should-be-verifiable.md,frontmatter-review,CLEAN,0,0,Claim strength,"The claim is specific and contestable. Someone could reasonably argue that document types serve as loose human-readable labels and don't need machine-checkable structural assertions, or that subject-matter classification is sufficient. The note argues a non-obvious position."
ephemeral-computation-prevents-accumulation.md,frontmatter-review,CLEAN,0,0,Claim strength,"The claim that ephemeral computation *prevents* accumulation is specific and contestable — one could argue ephemeral systems can still accumulate via logging, selective persistence, or side channels. The note takes a definite architectural stance (the ephemeral/accumulating fork is structural, not incidental), which is non-obvious enough to be worth asserting."
ephemeral-computation-prevents-accumulation.md,frontmatter-review,CLEAN,0,0,Description discrimination,"Description ""Ephemeral computation — discarding generated artifacts after use — trades accumulation for simplicity, making it the inverse of codification"" adds mechanism (""discarding generated artifacts after use""), a trade-off framing (""trades accumulation for simplicity""), and a positioning relationship (""the inverse of codification""). All three go beyond what the title carries, giving strong retrieval discrimination."
ephemeral-computation-prevents-accumulation.md,frontmatter-review,CLEAN,0,0,Title-body alignment,"The body directly supports the title's claim: it defines the ephemeral/accumulating fork, catalogs what ephemerality buys and costs, and frames ephemerality as anti-codification. The broader framing (spectrum between ephemeral and codified, the codification-relaxing dynamic) extends the claim rather than drifting from it — the title's assertion remains the central organizing thesis throughout."
files-not-database.md,frontmatter-review,CLEAN,0,0,claim-strength,"Contestable claim — many engineers would argue databases are superior even early on (structured queries, ACID guarantees, relational integrity). The note itself acknowledges Graphiti as a strong counterexample, confirming the claim is non-trivial."
files-not-database.md,frontmatter-review,CLEAN,0,0,description-discrimination,"Description adds mechanism (""a schema commits to access patterns before you know them"") and implication (""files let you constrain incrementally while getting free browsing, versioning, and agent access from day one"") that the title cannot carry. Strong retrieval discrimination — an agent seeing this among results about file-vs-database trade-offs would know immediately what angle this note takes."
files-not-database.md,frontmatter-review,CLEAN,0,0,title-composability,"""since files beat a database for agent-operated knowledge bases, we chose..."" reads naturally as a sentence fragment. Composes well."
human-writing-structures-transfer-to-llms-because-failure-modes-overlap.md,frontmatter-review,CLEAN,0,0,Claim strength,"The claim is specific and contestable -- someone could argue transfer works for other reasons (training distribution activation, not failure mode overlap) or that the failure modes diverge too much. Not a truism."
human-writing-structures-transfer-to-llms-because-failure-modes-overlap.md,frontmatter-review,CLEAN,0,0,Description discrimination,"The description adds mechanism (""LLMs exhibit empirically demonstrated human-like failure modes (content effects on reasoning)"") and scope (""per-convention transfer evaluation, not wholesale analogy"") beyond what the title carries. An agent seeing this among search results would know both the empirical grounding and the evaluation methodology this note advocates."
human-writing-structures-transfer-to-llms-because-failure-modes-overlap.md,frontmatter-review,CLEAN,0,0,Title-body alignment,"The body delivers exactly what the title promises: establishes empirical failure mode overlap via Lampinen et al. (syllogisms, Linda problem, Wason task), derives the per-convention evaluation methodology, and marks the Wason task as a concrete transfer boundary. The chain-of-thought discussion in the penultimate paragraph supports the main claim rather than drifting from it."
inspectable-substrate-not-supervision-defeats-the-blackbox-problem.md,frontmatter-review,CLEAN,0,0,Claim strength,"Contestable: Chollet's own position implicitly argues the opposite (agentic coding produces blackboxes like ML), and many practitioners would argue supervision is necessary regardless of substrate. The claim takes a specific, non-obvious stance."
inspectable-substrate-not-supervision-defeats-the-blackbox-problem.md,frontmatter-review,CLEAN,0,0,Description discrimination,"The description adds mechanism (""choosing a substrate (repo artifacts) that any agent can inspect, diff, test, and verify"") and context (Chollet's ML framing of agentic coding) beyond the title. It also names the rejected alternative (""not by requiring human review""), which helps an agent distinguish this note from supervision-focused notes. Strong discriminator."
inspectable-substrate-not-supervision-defeats-the-blackbox-problem.md,frontmatter-review,CLEAN,0,0,Title-body alignment,"The body directly supports the title's claim: it presents Chollet's blackbox framing, argues that repo artifacts break the analogy because they are inspectable (unlike weights), and maps ML failure modes to codification equivalents where every mitigation depends on inspectability. The final section on the verifiability gradient as the ""Keras"" answer extends the argument but stays within scope — it is presented as an implication of the core inspectability claim, not a separate thesis."
instruction-specificity-should-match-loading-frequency.md,frontmatter-review,CLEAN,0,0,Claim strength,"The claim is non-obvious and contestable. Someone could reasonably argue that all instructions should be always-loaded for reliability (eliminating the risk of missing a needed instruction), or that loading frequency should be driven by task type rather than instruction specificity. The note argues a specific design principle rather than a truism."
instruction-specificity-should-match-loading-frequency.md,frontmatter-review,CLEAN,0,0,Description discrimination,"The description adds mechanism the title cannot carry: it names the concrete 4-tier loading hierarchy (""CLAUDE.md -> skill descriptions -> skill bodies -> task docs"") and states the practical consequence (""always-loaded context competes for attention every session""). Against a list of search results about context loading or progressive disclosure, this description would clearly identify the note as the one about the specific tiered hierarchy and its design rationale."
instruction-specificity-should-match-loading-frequency.md,frontmatter-review,CLEAN,0,0,Title-body alignment,"The body directly supports the title's claim. It establishes a 4-tier loading hierarchy, explains the progressive disclosure principle, and gives concrete examples of what belongs at each level (universal rules in CLAUDE.md, task-specific rules in targeted files). No drift between title promise and body delivery."
learning-is-not-only-about-generality.md,frontmatter-review,CLEAN,0,0,description-discrimination,"The description adds substantial mechanism and scope beyond the title: it names Simon's definition as the grounding, introduces the accumulation/reach decomposition (facts vs theories), and the generality-vs-compound split. An agent seeing five search results about learning would immediately know this note provides a dimensional decomposition of capacity. Strong discriminator."
learning-is-not-only-about-generality.md,frontmatter-review,CLEAN,0,0,title-body-alignment,"The title claims learning is not only about generality; the body delivers on this by establishing the generality-vs-compound decomposition and then going further into accumulation, reach, and composability as additional dimensions. The body covers more than the title strictly promises (accumulation/reach gets substantial treatment), but the title's ""not only"" framing is broad enough to accommodate this. No misalignment — the body supports and extends the title's claim."
learning-is-not-only-about-generality.md,frontmatter-review,CLEAN,0,0,title-composability,"""since learning is not only about generality, we designed the compound dimension..."" reads naturally as a sentence fragment. No grammar issues when linked."
link-following-and-search-impose-different-metadata-requirements.md,frontmatter-review,CLEAN,0,0,description-discrimination,"Description ""Link-following is local with context; search is long-range with titles/descriptions; indexes bridge both modes"" adds mechanism the title cannot carry -- it specifies what makes the metadata requirements different (locality vs. long-range, context vs. titles/descriptions) and names the bridging role of indexes. An agent seeing five search results would be able to distinguish this note from adjacent notes on linking or search."
link-following-and-search-impose-different-metadata-requirements.md,frontmatter-review,CLEAN,0,0,title-body-alignment,"The body delivers what the title promises: it defines the two navigation modes (link-following and search), identifies what each requires from metadata (surrounding context vs. titles/descriptions), and adds indexes as a bridge case. No drift detected."
link-following-and-search-impose-different-metadata-requirements.md,frontmatter-review,CLEAN,0,0,title-composability,"""since link-following and search impose different metadata requirements, we designed..."" reads naturally as a sentence fragment. No awkward grammar when used as an inline link."
maintenance-operations-catalogue-should-stage-distillation-into-instructions.md,frontmatter-review,CLEAN,0,0,Claim strength,"The claim that a catalogue is the right staging form before promotion to instructions is specific and contestable. One could argue operations should go directly into instructions without a staging intermediary, or that a different staging mechanism (task backlog, log entries) would work better."
maintenance-operations-catalogue-should-stage-distillation-into-instructions.md,frontmatter-review,CLEAN,0,0,Description discrimination,"The description adds mechanism and scope beyond the title. The title asserts a design claim (catalogue *should* stage distillation); the description clarifies that the note is itself the catalogue, tracks distillation status, and names the promotion target (`kb/instructions procedures`). An agent choosing among search results would learn both what the note contains and what its operational role is."
maintenance-operations-catalogue-should-stage-distillation-into-instructions.md,frontmatter-review,CLEAN,0,0,Title-body alignment,"The body supports the title on both axes: it argues the rationale for staging (operations start manual, need varied-context repetition before codification) and provides the actual catalogue with per-entry distillation status. No drift detected."
memory-management-policy-is-learnable-but-oracle-dependent.md,frontmatter-review,CLEAN,0,0,Claim strength,"The conjunction is genuinely contestable on both halves. Someone could argue memory management policy is too context-dependent to learn reliably, or that self-supervised signals could remove the oracle dependency. The ""but oracle-dependent"" qualifier is the specific, non-obvious part — it narrows a positive result (learnable) with a concrete limitation."
