note,review_type,level,note_warn_count,check_warn_count,check,finding
distillation.md,frontmatter-review,WARN,1,1,Title composability,"Title is a bare noun (""Distillation"") — ""since distillation..."" does not read as a complete clause. The note is definitional/term-pinning, which exempts it from the claim-strength check, but bare-noun titles still compose poorly as link targets. Other notes currently link to it with inline context (e.g., ""[constraining](./constraining.md) — co-equal mechanism""), which works but means every linker must supply its own gloss."
automated-tests-for-text.md,frontmatter-review,INFO,0,1,Title composability,"The title ""Automated tests for text"" is a bare topic noun phrase. ""since automated tests for text..."" does not read as a natural sentence fragment. As a reference link (""see [automated tests for text](...)"") it works fine, and the note is a framework note where topical titles are acceptable — but a claim-shaped title like ""text artifacts can be tested with the same pyramid as software"" would compose better and carry more information at link sites."
constraining.md,frontmatter-review,INFO,0,1,Title composability,"The title ""Constraining"" is a bare gerund — ""since constraining..."" does not read as a complete clause. This is a definitional/term-pinning note (description opens with ""Definition —""), where a bare concept name is the conventional pattern. Composability cost is real but justified here; linked references typically wrap it naturally (e.g., ""[constraining](./constraining.md) narrows the interpretation space"")."
agentic-systems-interpret-underspecified-instructions.md,frontmatter-review,INFO,0,0,Title-body alignment,"The title foregrounds semantic underspecification (""interpret underspecified instructions"") but the body's central argument is a two-phenomena distinction: underspecification vs. indeterminism, with the claim that indeterminism obscures the deeper difference. The two-phenomena separation, the obscuring dynamic, the spec-to-program projection model, and the constraining/relaxing framework are all major body contributions that the title doesn't signal. The title names the more important half accurately, so this is not a misalignment -- but the body establishes significantly more than the title promises, functioning as a theoretical framework note rather than a single-claim note. If the note were titled to signal the two-phenomena distinction (e.g., ""semantic underspecification is the deeper difference in agentic systems, not indeterminism""), the title would better predict the body's actual argument."
claim-notes-should-use-toulmin-derived-sections-for-structured-argument.md,frontmatter-review,INFO,0,0,Title-body alignment,"The title focuses on the prescription ""should use Toulmin-derived sections."" The body delivers on this but also covers substantial type-system design territory: why `structured-claim` should be a base type rather than a trait, the naming choice over plain `claim`, the promotion path from `note`, the retirement of `has-claim`, and a full section template with deterministic/semantic check specifications. The body reads more like a design decision record for creating the `structured-claim` type than a note arguing that Toulmin sections are the right choice. The title's claim is the foundation for all of this, so the alignment is not broken -- but readers arriving for the Toulmin argument may be surprised by the scope of type-system machinery."
codification.md,frontmatter-review,INFO,0,0,title-composability,"The title ""Codification"" is a bare topic word — ""since codification"" does not read as a natural sentence fragment. However, this is a definitional note (description opens with ""Definition —"") that pins vocabulary for the KB. Bare topic titles are correct for term-pinning notes, so this does not rise to WARN."
document-types-should-be-verifiable.md,frontmatter-review,INFO,0,0,Description discrimination,"The first clause (""Document types should assert verifiable structural properties, not subject matter"") closely paraphrases the title, adding only ""structural properties, not subject matter."" The second clause (""with a base type + traits model inspired by gradual and structural typing"") does genuine discriminating work by naming the specific design approach. The description functions adequately for retrieval but could lead with mechanism or scope rather than a near-restatement. A tighter alternative might foreground the mechanism: e.g., ""A base-type-plus-traits model inspired by gradual and structural typing; types assert checkable structure so agents and scripts can act on them, while subject matter belongs in tags."""
document-types-should-be-verifiable.md,frontmatter-review,INFO,0,0,Title-body alignment,"The title asserts the principle ""document types should be verifiable,"" and the body supports it thoroughly. However, the body also delivers a complete design (base types + traits, the verifiability gradient, programming language parallels, tolerance of misclassification) that goes well beyond the principle claim. The title names the motivation; the body is really the design note for the type system. This is not a misalignment -- the principle is genuinely argued -- but an agent reading only the title would underestimate the note's scope as a design artifact."
files-not-database.md,frontmatter-review,INFO,0,0,title-body-alignment,"The title ""Files beat a database for agent-operated knowledge bases"" is an unqualified claim, but the body substantially qualifies it: ""This isn't a files-forever position"" and the entire Graphiti section identifies where the trade-off tips in favor of a database. The body's actual argument is closer to ""files beat a database early on, for authored agent-navigated knowledge"" — which the description captures better than the title does. The mismatch is minor (the title is a reasonable shorthand for the primary claim), but the body's qualified position is meaningfully different from the title's absolute framing."
learning-is-not-only-about-generality.md,frontmatter-review,INFO,0,0,claim-strength,"The title ""Learning is not only about generality"" uses a negation (""not only"") rather than asserting the positive claim. The body actually establishes a specific decomposition: capacity = generality + reliability/speed/cost compound, with accumulation/reach as a separate axis within generality. A sharper title might name what learning IS about rather than what it's not only about — e.g., ""capacity decomposes into generality and a reliability-speed-cost compound"" or ""learning improves generality and a reliability-speed-cost compound independently."" The current phrasing is not wrong, and the negation does contest a real default assumption, but it leaves the positive contribution implicit."
link-following-and-search-impose-different-metadata-requirements.md,frontmatter-review,INFO,0,0,claim-strength,"The claim ""link-following and search impose different metadata requirements"" is a correct structural observation but unlikely to provoke disagreement from anyone who has thought about navigation modes. It sits at the border between a specific insight and a truism. Worth monitoring if the note is ever revised -- sharpening toward the non-obvious part (e.g., that indexes must satisfy both sets of requirements simultaneously) could strengthen the title."
distillation.md,frontmatter-review,CLEAN,1,0,Claim strength,"Title is topical, not phrased as a claim. The note is definitional (term pinning) — topical titles are correct for this purpose per the exceptions list."
distillation.md,frontmatter-review,CLEAN,1,0,Description discrimination,"Description ""Definition — distillation compresses knowledge so a consumer can act on it within bounded context, making operations feasible that raw source material would exceed; co-equal learning mechanism alongside constraining"" adds mechanism (compression for bounded context), implication (feasibility, not just optimization), and positioning (co-equal with constraining). Against 5 search results for ""distillation,"" this clearly identifies the definitional note for the KB-specific sense of the term."
distillation.md,frontmatter-review,CLEAN,1,0,Title-body alignment,"Topical title ""Distillation"" promises a definitional treatment. The body delivers exactly that: a definition, relationship to context engineering, prior work survey, operational mechanics with examples, orthogonality to constraining, and ML terminology disambiguation. No scope or claim drift."
agent-context-is-constrained-by-soft-degradation-not-hard-token-limits.md,frontmatter-review,CLEAN,0,1,Title composability,"""since agent context is constrained by soft degradation, not hard token limits..."" reads naturally as a sentence fragment. The claim structure composes well in link contexts."
agentic-systems-interpret-underspecified-instructions.md,frontmatter-review,CLEAN,0,1,Title composability,"""since agentic systems interpret underspecified instructions, we designed..."" reads naturally as a sentence fragment. The title functions well as a linkable prose element."
agents-md-should-be-organized-as-a-control-plane.md,frontmatter-review,CLEAN,0,1,Title composability,"""since AGENTS.md should be organized as a control plane, we designed the routing table with three layers"" reads naturally as a sentence fragment. The title composes well in linking contexts."
agents-navigate-by-deciding-what-to-read-next.md,frontmatter-review,CLEAN,0,1,Title composability,"""since agents navigate by deciding what to read next, we designed..."" reads naturally as a sentence fragment. Works as inline link text."
bitter-lesson-boundary.md,frontmatter-review,CLEAN,0,1,Title composability,"""since the bitter lesson has a boundary, we need to identify which side each component is on"" reads naturally as a sentence fragment. Composes well in linking contexts."
capability-placement-should-follow-autonomy-readiness.md,frontmatter-review,CLEAN,0,1,Title composability,"""since capability placement should follow autonomy readiness, we designed..."" reads naturally as a linked prose fragment. The claim-as-title pattern composes well."
claim-notes-should-use-toulmin-derived-sections-for-structured-argument.md,frontmatter-review,CLEAN,0,1,Title composability,"""since claim notes should use Toulmin-derived sections for structured argument, we adopted..."" reads naturally as a sentence fragment."
codification-and-relaxing-navigate-the-bitter-lesson-boundary.md,frontmatter-review,CLEAN,0,1,Title composability,"""since codification and relaxing navigate the bitter lesson boundary, we designed..."" reads naturally as a sentence fragment. The title works as a linkable prose phrase."
constraining-and-distillation-both-trade-generality-for-reliability-speed-and-cost.md,frontmatter-review,CLEAN,0,1,Title composability,"""since constraining and distillation both trade generality for reliability, speed, and cost, we designed..."" reads as a natural sentence fragment. The title works as a linkable clause."
constraining-during-deployment-is-continuous-learning.md,frontmatter-review,CLEAN,0,1,Title composability,"""since constraining during deployment is continuous learning, we designed the KB to track artifact evolution as a learning signal"" reads naturally as a linked prose fragment."
context-efficiency-is-the-central-design-concern-in-agent-systems.md,frontmatter-review,CLEAN,0,1,Title composability,"""since context efficiency is the central design concern in agent systems, we designed the loading strategy around..."" reads naturally as a sentence fragment. No awkwardness when linked."
continuous-learning-requires-durability-not-weight-updates.md,frontmatter-review,CLEAN,0,1,Title composability,"""since continuous learning requires durability, not weight updates..."" reads naturally as a sentence fragment. The comma-separated contrast (""durability, not weight updates"") survives inline linking without grammatical friction."
document-classification.md,frontmatter-review,CLEAN,0,1,Title composability,"""Document classification"" is a bare topical title that doesn't compose as a sentence fragment (""since document classification..."" is incomplete). However, the note is type `spec` with status `current` — it is a reference specification defining a taxonomy, not a claim. Topical titles are the correct form for specs and framework definitions."
document-types-should-be-verifiable.md,frontmatter-review,CLEAN,0,1,Title composability,"""since document types should be verifiable, we designed the type system around checkable structural properties"" reads naturally as a sentence fragment. No awkward grammar when linked."
ephemeral-computation-prevents-accumulation.md,frontmatter-review,CLEAN,0,1,Title composability,"""since ephemeral computation prevents accumulation, we designed the persistence layer to..."" reads naturally as a sentence fragment. The title works as a linkable prose clause."
human-writing-structures-transfer-to-llms-because-failure-modes-overlap.md,frontmatter-review,CLEAN,0,1,Title composability,"""since human writing structures transfer to LLMs because failure modes overlap"" reads naturally as a sentence fragment and can be woven into linking prose without grammatical awkwardness."
inspectable-substrate-not-supervision-defeats-the-blackbox-problem.md,frontmatter-review,CLEAN,0,1,Title composability,"""since inspectable substrate, not supervision, defeats the blackbox problem"" reads naturally as a sentence fragment in another note's argument. The parenthetical comma structure is slightly unusual but parses correctly."
instruction-specificity-should-match-loading-frequency.md,frontmatter-review,CLEAN,0,1,Title composability,"""since instruction specificity should match loading frequency, we designed the CLAUDE.md as a slim router"" reads naturally as a sentence fragment. The title functions well as a linkable prose phrase."
maintenance-operations-catalogue-should-stage-distillation-into-instructions.md,frontmatter-review,CLEAN,0,1,Title composability,"""since maintenance operations catalogue should stage distillation into instructions, we capture new operations here first"" reads naturally as a linked prose fragment."
memory-management-policy-is-learnable-but-oracle-dependent.md,frontmatter-review,CLEAN,0,1,Title composability,"""since memory management policy is learnable but oracle-dependent, the KB's automation bottleneck is evaluation, not mechanism"" reads naturally. The claim-form title composes as a sentence fragment without forcing awkward grammar."
periodic-kb-hygiene-should-be-externally-triggered-not-embedded-in-routing.md,frontmatter-review,CLEAN,0,1,Title composability,"""since periodic KB hygiene should be externally triggered, not embedded in routing, we keep the default path lightweight"" reads naturally as a sentence fragment."
specification-level-separation-recovers-scoping-before-it-recovers-error-correction.md,frontmatter-review,CLEAN,0,1,Title composability,"""since specification-level separation recovers scoping before it recovers error correction, we should expect..."" reads naturally as a sentence fragment. The title is long but grammatically complete and composes without awkwardness."
stale-indexes-are-worse-than-no-indexes.md,frontmatter-review,CLEAN,0,1,Title composability,"""since stale indexes are worse than no indexes, we designed maintenance routines that..."" reads naturally as a sentence fragment. The claim-shaped title composes well in linking contexts."
title-as-claim-enables-traversal-as-reasoning.md,frontmatter-review,CLEAN,0,1,Title composability,"""since title as claim enables traversal as reasoning, we designed the link semantics around argumentative connectives"" reads naturally as a sentence fragment. The title composes well as a linkable prose element."
agent-context-is-constrained-by-soft-degradation-not-hard-token-limits.md,frontmatter-review,CLEAN,0,0,Claim strength,The claim is specific and contestable. Many practitioners and providers treat the hard token limit as the primary constraint (it is the marketed metric and the one that drives purchasing decisions). Someone could reasonably argue that for large-codebase agentic tasks the hard limit remains binding. The note takes a real position.
agent-context-is-constrained-by-soft-degradation-not-hard-token-limits.md,frontmatter-review,CLEAN,0,0,Description discrimination,"The description adds mechanism (""silent degradation — undisclosed, unmeasured, and invisible at the point of failure"") and structural scope (""operates across two dimensions (volume and complexity) while the hard bound is volume-only"") beyond what the title carries. An agent seeing five results about context limits would immediately know this note argues invisibility is the critical property and decomposes the soft bound into two dimensions."
agent-context-is-constrained-by-soft-degradation-not-hard-token-limits.md,frontmatter-review,CLEAN,0,0,Title-body alignment,"The body directly supports the title's claim. The two major sections — ""Two dimensions of the soft bound"" and ""The soft bound is invisible and undisclosed"" — develop why soft degradation is the binding constraint. The ""Consequences for practitioners"" section derives actionable implications from that claim. No drift detected between title promise and body delivery."
agent-statelessness-makes-routing-architectural-not-learned.md,frontmatter-review,CLEAN,0,0,claim-strength,"The claim is specific and contestable. One could argue that persistent memory relaxes the statelessness assumption enough to make routing learned (the note itself acknowledges this in its final paragraph), or that routing is always architectural regardless of consumer type. The title names a specific causal mechanism (statelessness) and a specific consequence (architectural vs. learned), which is a non-obvious position."
agent-statelessness-makes-routing-architectural-not-learned.md,frontmatter-review,CLEAN,0,0,description-discrimination,"The description adds mechanism (""agents never develop navigation intuition — every session is day one"") and implication (""permanent architecture, not scaffolding that learners outgrow"") beyond what the title carries. The enumeration of concrete routing artifacts (skills, type templates, routing tables, naming conventions, activation triggers) further discriminates this note from adjacent notes about routing or statelessness in general. An agent searching for ""routing architecture"" would clearly distinguish this from, say, an instruction-specificity note."
agent-statelessness-makes-routing-architectural-not-learned.md,frontmatter-review,CLEAN,0,0,title-body-alignment,"The body directly supports the title's claim through four sections: the statelessness observation (why agents never learn), progressive disclosure (the architectural replacement for navigation intuition), the degradation cliff (what happens when routing is missing), and the source-vs-compiled distinction (the maintenance discipline that follows). All sections develop the title's central argument without drifting into unrelated territory. The design consequences section stays within scope by deriving requirements from the architectural nature of routing."
agent-statelessness-makes-routing-architectural-not-learned.md,frontmatter-review,CLEAN,0,0,title-composability,"""since agent statelessness makes routing architectural, not learned, we designed the progressive disclosure hierarchy as permanent infrastructure"" reads naturally as a sentence fragment. The title works well as a linkable clause."
agentic-systems-interpret-underspecified-instructions.md,frontmatter-review,CLEAN,0,0,Claim strength,"The framing of LLM behavior as ""interpretation of underspecified instructions"" is genuinely contestable. Many practitioners treat LLM outputs as stochastic outputs of a fixed program -- the ""interpret"" and ""underspecified"" framing is a specific theoretical commitment that someone could reasonably argue against (e.g., by arguing LLMs are better modeled as noisy function approximators, not interpreters)."
agentic-systems-interpret-underspecified-instructions.md,frontmatter-review,CLEAN,0,0,Description discrimination,"The description adds mechanism well beyond the title: it names the two distinct properties (semantic underspecification and execution indeterminism), identifies which is deeper, introduces the spec-to-program projection model, and names the obscuring dynamic between the two phenomena. An agent seeing this among 5 search results would immediately know this is the theoretical two-phenomena framing, not a generic note about agentic systems or prompt engineering."
agents-md-should-be-organized-as-a-control-plane.md,frontmatter-review,CLEAN,0,0,Claim strength,"The claim that AGENTS.md should be organized as a ""control plane"" is specific and contestable. Reasonable alternatives exist: organizing it as a comprehensive reference manual, a minimal pointer file, or a flat checklist. The control-plane metaphor carries a non-obvious commitment to functional placement (invariants, routing, escalation) over topical or chronological organization."
agents-md-should-be-organized-as-a-control-plane.md,frontmatter-review,CLEAN,0,0,Description discrimination,"Description ""Theory for deciding what belongs in AGENTS.md using loading frequency and failure cost, with layers, exclusion rules, and migration paths"" adds mechanism (the two decision variables: loading frequency and failure cost) and scope (layers, exclusion rules, migration paths) beyond what the title carries. An agent seeing multiple results about AGENTS.md organization would immediately know this note provides a specific placement framework, not general advice."
agents-md-should-be-organized-as-a-control-plane.md,frontmatter-review,CLEAN,0,0,Title-body alignment,"The body delivers exactly what the title promises. It defines the control-plane model via two placement variables (loading frequency, failure cost), specifies three layers (invariants, routing, escalation boundaries), and adds supporting structure (nested topology, exclusion rules, lifecycle migration, quality tests). No drift in either direction."
agents-navigate-by-deciding-what-to-read-next.md,frontmatter-review,CLEAN,0,0,Claim strength,"The claim that navigation reduces to a per-pointer read/skip decision is a specific framing, not the only one — someone could argue agents navigate via structured plans, exhaustive scanning, or orchestrator routing. The claim is contestable and carries information."
agents-navigate-by-deciding-what-to-read-next.md,frontmatter-review,CLEAN,0,0,Description discrimination,"The description adds mechanism (""context surrounding a pointer ... determines how cheaply an agent can judge relevance without loading the target"") and scope (""inline links carry most context, search results carry least"") beyond the title's general claim. An agent searching for ""pointer context"" or ""navigation cost"" would immediately distinguish this note from others about agent navigation. The prior review's WARN about description restating the title has been addressed — the description now leads with the cost mechanism and names the pointer-type spectrum."
agents-navigate-by-deciding-what-to-read-next.md,frontmatter-review,CLEAN,0,0,Title-body alignment,"The body opens by establishing the per-pointer decision framing, then develops what makes that decision tractable (context richness of different pointer types) and closes with design implications. The title captures the framing; the body delivers on it. The note's deeper contribution (the context-cost analysis) lives in the description, which is the intended division of labor between title and description in this KB."
automated-tests-for-text.md,frontmatter-review,CLEAN,0,0,Claim strength,"The title is topical, not a claim. This is appropriate: the note describes a multi-level testing framework rather than arguing a single point. Topical titles are correct for framework notes per the exceptions list."
automated-tests-for-text.md,frontmatter-review,CLEAN,0,0,Description discrimination,"The description adds mechanism (test pyramid with three named levels: deterministic checks, LLM rubrics, corpus compatibility) and a design principle (""built from real failures not taxonomy"") that the title cannot carry. An agent choosing among search results would easily identify this note from the description alone."
automated-tests-for-text.md,frontmatter-review,CLEAN,0,0,Title-body alignment,"The body delivers exactly what the title promises — a framework for automated testing of text artifacts. It covers the test pyramid, the connection to document types, the design principle, and the current implementation status. No drift detected."
bitter-lesson-boundary.md,frontmatter-review,CLEAN,0,0,Claim strength,"""The bitter lesson has a boundary"" is contestable — many practitioners treat the bitter lesson as universal, so asserting a boundary is a substantive claim that someone knowledgeable could argue against."
bitter-lesson-boundary.md,frontmatter-review,CLEAN,0,0,Description discrimination,"Description adds mechanism (""whether the specification fully captures the problem""), scope (arithmetic vs. vision-feature regimes), and a diagnostic (""composition failure is the diagnostic tell""). None of this is inferable from the title alone. Would clearly distinguish this note from other bitter-lesson-related search results."
