check,warn_count,info_count,clean_count,sample_note,sample_finding
Pseudo-formalism,0,2,38,,
Redundant restatement,0,5,35,,
Anthropomorphic framing,1,11,28,agents-navigate-by-deciding-what-to-read-next.md,"The note consistently uses ""she/her"" pronouns and human-like agency language for agents: ""An agent has a task and needs information she doesn't yet have,"" ""lets her judge without paying that cost,"" ""the agent knows both what's there and why it matters before deciding."" While the note's title uses ""agents"" generically, the body reads as if describing a human researcher rather than an LLM-based agent. Verbs like ""knows,"" ""decides,"" and ""judge"" attribute cognitive capacities without qualification."
Unbridged cross-domain evidence,2,3,35,context-efficiency-is-the-central-design-concern-in-agent-systems.md,"The ""Prior work"" section cites Simon (1971) on human attention, Miller (1956) and Cowan (2001) on human working memory, and Toffler (1970) on human information overload. The bridging sentence — ""What's specific to agent systems is the unitary channel, the hard token limit, and the interaction between volume and complexity"" — identifies differences but does not explain the shared mechanism that makes the human findings relevant. Why does human attention economics transfer to token-based context windows? The analogy is plausible but the note treats it as self-evident."
Orphan references,3,2,35,agent-context-is-constrained-by-soft-degradation-not-hard-token-limits.md,"""Context windows have grown roughly 30x per year since mid-2023"" — this is a specific empirical claim with no source citation. It appears mid-paragraph as if it were common knowledge, but the growth rate is precise enough to need attribution. If the number is approximate, the precision of ""30x per year"" overstates the confidence; if it's sourced, the source should be cited."
Source residue,8,19,21,agentic-systems-interpret-underspecified-instructions.md,"The note claims broad generality (""A theoretical framing for LLM-based agentic systems"") but several examples are narrowly from software engineering without being framed as illustrative: ""Refactor for Readability"" (a coding assistant task), ""sanitize_filename()"" (a file-renaming agent), ""is '2024-03' a date or a version?"" These read as the natural examples of the author's domain rather than chosen illustrations. The ""Refactor for Readability"" section heading and walkthrough (extract helper functions, rename variables, restructure control flow, add comments) are all code-specific. A reader outside software engineering could miss that the framework applies to their domain."
Proportion mismatch,19,16,5,agent-statelessness-makes-routing-architectural-not-learned.md,"The core claim is in the title: routing is architectural, not learned. The section that carries the most weight for this claim is the opening (untitled) section plus ""Progressive disclosure replaces navigation intuition"" — together roughly 250 words. ""The degradation cliff"" and ""Source vs. compiled"" each get comparable or greater development (~200 and ~200 words respectively), but they are consequences of the core claim rather than the claim itself. The ""Source vs. compiled"" section in particular develops a source-code/compiled-artifact metaphor at length that, while valuable, is arguably a separate note's worth of content (the compilation pattern, quality criteria for source vs. compiled, the relationship to instruction specificity). The core insight — that the agent never develops navigation intuition — is established quickly and then the note moves on to downstream implications that receive more development than the motivating argument."
Confidence miscalibration,34,6,1,agent-context-is-constrained-by-soft-degradation-not-hard-token-limits.md,"""LLMs pay interpretation overhead proportional to context complexity"" — the word ""proportional"" asserts a specific functional relationship (linear scaling) that the note does not establish or cite. The ConvexBench reference supports complexity-driven collapse, but collapse is not proportionality. The claim is stronger than the evidence offered for it."
